<?xml version="1.0" encoding="utf-8"?>
<tickets xmlns:xsi = "http://www.w3.org/2001/XMLSchema-instance" xsi:noNamespaceSchemaLocation="ticket_details.xsd">
	<!--ticket 1-->
	<ticket id="1" user_id="mg" dt="2020-02-16T05:50:06">
		<!--status of ticket ongoing or solved-->
		<ticket_status>on-going</ticket_status>
		<complaint>product not working well</complaint>
		<reply>Will look into it</reply>
	</ticket>
	<ticket id="2" user_id="mg" dt="2020-03-25T11:10:25">
		<!--status of ticket ongoing or solved-->
		<ticket_status>solved</ticket_status>
		<complaint>product starts working well</complaint>
		<reply>Solved</reply>
	</ticket>
	<ticket id="3" user_id="k" dt="2010-03-25T14:10:25">
		<!--status of ticket ongoing or solved-->
		<ticket_status>ongoing</ticket_status>
		<complaint>check this complaint</complaint>
		<reply>working on it!</reply>
	</ticket>
</tickets>
